"iteration","app_name","categoryId","reviewId","sentenceId","at","score","feature","review","sentence","Joy","Trust","Fear","Surprise","Sadness","Disgust","Anger","Anticipation","Neutral","Reject"
"iteration_9","Binaural Beats Therapy","HEALTH_AND_FITNESS","38090fcf-feb7-480d-8f8b-3d5e4bd5e26f","0","Jun 20, 2022","5","f_83","Mainly feel much relaxation after use. Most effective especially if one works nights.","Mainly feel much relaxation after use.","1","0","0","0","0","0","0","0","0","0"
"iteration_9","Notebook - Notes,To-do,Journal","PRODUCTIVITY","c7780ae3-c873-4f34-af15-4a9998527086","0","Jul 06, 2022","3","f_262","Good for taking notes, could improve the tagging system by having the option to add more accessible (like replacing the share to other people button) and would be better if we could integrate or share the notebooks or notes to other programs like notion or evernote.","Good for taking notes, could improve the tagging system by having the option to add more accessible (like replacing the share to other people button) and would be better if we could integrate or share the notebooks or notes to other programs like notion or evernote.","0","0","0","0","0","0","0","1","0","0"
"iteration_9","Habit Tracker","PRODUCTIVITY","84cac888-2a1e-436c-ab82-baedec9acef6","0","Feb 03, 2021","5","f_115","This app is very great,Being mobile app developer makes me respect this app a lot just simple and do what I want without any complexity thanks Habit Tracker team","This app is very great,Being mobile app developer makes me respect this app a lot just simple and do what I want without any complexity thanks Habit Tracker team","1","1","0","0","0","0","0","0","0","0"
"iteration_9","MixNote NotePad Notes","PRODUCTIVITY","3134d92f-8496-441a-87d8-a5d89d67be7e","0","Oct 31, 2020","4","f_30","I really appreciate this app but lately I've been have issues with the cloud sync. It's worrisome coz i don't wanna lose all my notes but I just might :(.","I really appreciate this app but lately I've been have issues with the cloud sync.","0","0","1","0","0","0","0","0","0","0"
"iteration_9","Google Find My Device","TOOLS","f0bff6ab-8fa5-4f9e-acc5-4970e817db8a","0","Jun 04, 2022","5","f_502","We can trusted for a while to protect our lost devices priorities and privacy!!","We can trusted for a while to protect our lost devices priorities and privacy!!","0","1","0","0","0","0","0","0","0","0"
"iteration_9","GTasks: Todo List & Task List","PRODUCTIVITY","e39a7acc-9836-4fe1-8dc1-bf76c88866bd","1","Sep 10, 2020","1","f_257","paid for this app and now they added ads to it anyway. now it doesnt sync across devices AND you get ads to despite paying for it... if i could rate this app lower i would.. they have since increased the ads on it.. TERRBLE COMPANY!","now it doesnt sync across devices AND you get ads to despite paying for it... if i could rate this app lower i would.. they have since increased the ads on it..","0","0","0","0","0","0","1","0","0","0"
"iteration_9","Boosted Time Tracker","PRODUCTIVITY","f34a3795-7c25-41d8-b400-4cb8ca63e9b3","0","Aug 30, 2021","5","f_68","Minimalistic yet elegant aesthetic. Useful for using as a way to tracking the amount of time you are using to work on your prohects.","Minimalistic yet elegant aesthetic.","1","0","0","0","0","0","0","0","0","0"
"iteration_9","Geometric Weather","WEATHER","8d78cf2d-e072-4b77-ba7b-7413226f356c","3","Jun 03, 2022","3","f_472","I like the way it looks and feels. Not a bunch of clutter. I would use it as my regular weather app (and even pay a small on time fee for it). Except for 1 thing is missing - there is no Radar! So I have to now install another app to get a radar. So I might as well just use a single different weather app instead of 2 apps. If this app had a decent radar, I would use it and give it 5 stars.","Except for 1 thing is missing - there is no Radar!","0","0","0","0","1","0","0","0","0","0"
"iteration_9","Boosted Time Tracker","PRODUCTIVITY","f68705cc-f5f5-45b2-8e3e-745c98269fc5","1","Mar 23, 2022","5","f_56","Very intuitive and highly reliable, doing exactly what you'd want it to do. Export to csv avoids lock-in of collected data, backups to Google Drive provide safety while all data are stored locally to secure privacy. Recommended!","Export to csv avoids lock-in of collected data, backups to Google Drive provide safety while all data are stored locally to secure privacy.","0","1","0","0","0","0","0","0","0","0"
"iteration_9","Weather data & microclimate :","WEATHER","41d30c8c-c72b-4e6c-8530-8ceaea2f3ac6","0","Jun 12, 2022","5","f_2","Once familiar with extended functions it's very good, and that is also for the full web service.","Once familiar with extended functions it's very good, and that is also for the full web service.","1","0","0","0","0","0","0","0","0","0"
"iteration_9","Stuff - To Do List Widget","PRODUCTIVITY","5de8f770-9cee-4c30-8f57-31eed1763d82","1","Nov 18, 2021","5","f_301","I am very happy with this app! I love the dark theme and being able to have my to do list as a widget. So now every time I unlock my phone I can see what I've done and still need to do. I'm enjoying how you can simply add things using the widget and select what you have completed! Ah, I love it. I already feel more motivated to get things done. Thank you. :)","I love the dark theme and being able to have my to do list as a widget.","1","0","0","0","0","0","0","0","0","0"
"iteration_9","SMS Backup+","TOOLS","71563132-df56-497d-bfcd-f703bfab6384","1","Feb 07, 2022","1","f_398","Just downloaded app, and it asked me to link a Google email account. However, Google blocked the access to two different GMail accounts, effectively rendering this app useless.","However, Google blocked the access to two different GMail accounts, effectively rendering this app useless.","0","0","0","0","1","1","0","0","0","0"
"iteration_9","WhatsApp Messenger","COMMUNICATION","9a6b7f9a-8bd7-40e2-b598-fe4449ad961c","0","Sep 15, 2022","4","f_235","Please put an option for privacy like to hide Online.","Please put an option for privacy like to hide Online.","0","0","0","0","0","0","0","1","0","0"
"iteration_9","Galaxy Wearable (Samsung Gear)","TOOLS","95b956df-89fb-4a89-b5a9-cfdb6382f8d6","4","Aug 26, 2022","1","f_20","All Samsung Co ever does is WEAR OUT. Why? They are the most retarded corporation in the universe! Because they cheat by Oracle Java and Python3>.","Because they cheat by Oracle Java and Python3>.","0","0","0","0","0","0","1","0","0","0"
"iteration_9","Google Find My Device","TOOLS","a278764e-a78a-4d95-9a05-429f597aec7e","0","Aug 08, 2022","4","f_160","Could use Real-time background access. Tracking continually","Could use Real-time background access.","0","0","0","0","0","0","0","1","0","0"
"iteration_9","Note Plus - Notepad, Checklist","PRODUCTIVITY","6a61cecd-7902-4620-b938-e4ae16e9ca40","8","Aug 18, 2022","2","f_247","I got here through pop up in the app ""will you give us 5 stars"" it said. I WOULD have given 5 stars! I WAS a great app!! Functionally it still is a great app. What changed? The ads! I had this app with out ads and it was awesome simple smooth easy loved it made sure to get THIS one on my various replacement phones I liked it so much. But now, not smooth at all, ads for every action! Load in ad understandable, writing a note/checklist navigate away ad, switch from one note to another ad.","Load in ad understandable, writing a note/checklist navigate away ad, switch from one note to another ad.","0","0","0","0","1","0","0","0","0","0"
"iteration_9","Telegram","COMMUNICATION","dbe4ea5a-411f-4d9c-9ca1-31b65665a266","2","Aug 22, 2022","5","f_54","Love this App and wish that everyone around me can start using this more than What's app. Super handy and I love all the functions and privacy settings even the fact that you can connect to people around you if you choose to I love it! One downfall my notifications doesn't always come through when I receive a message if I don't go in everyday if that could get fixed I have no complaints","One downfall my notifications doesn't always come through when I receive a message if I don't go in everyday if that could get fixed I have no complaints","0","0","0","0","1","0","0","0","0","0"
"iteration_9","True Phone Dialer & Contacts","COMMUNICATION","9ad7437e-36e9-435d-a3c5-8d4a54d96d73","1","Dec 04, 2021","5","f_214","great app.. a feature request. Is it possible that true phone acts like a web server and I can use a browser to load contacts on my laptop and dial contacts from my laptop and calls should get placed via mobile. this feature if possible will help me to buy 20 paid licenses for my users. the browser based extension should be able to load contacts and dial from laptop briwser.","Is it possible that true phone acts like a web server and I can use a browser to load contacts on my laptop and dial contacts from my laptop and calls should get placed via mobile.","0","0","0","0","0","0","0","1","0","0"
"iteration_9","Telegram X","SOCIAL","46391414-8239-44cd-9ecd-67b40b87170d","0","Jul 30, 2022","1","f_339","From the last 30 days I am facing some serious problem with telegram, not even a single document is downloading, I have tried many ways to fix this problem but no progress.. anyone plz tell me how to fix this","From the last 30 days I am facing some serious problem with telegram, not even a single document is downloading, I have tried many ways to fix this problem but no progress.. anyone plz tell me how to fix this","0","0","0","0","1","0","0","0","0","0"
"iteration_9","Clock","TOOLS","7c509bd5-d155-449b-96c7-1339a15c0981","0","Sep 02, 2022","1","f_236","No World Clock widget? Why is the tablet version different to the phone version?","No World Clock widget?","0","0","0","1","0","0","0","0","0","0"
"iteration_9","ColorNote Notepad Notes","PRODUCTIVITY","8d4b41c1-4165-4de4-acc4-4a580a7a71fa","1","Jul 22, 2022","5","f_482","Best note app i have ever had. All your notes that have a Password gets an almost impossible encryption. enjoy","All your notes that have a Password gets an almost impossible encryption.","0","1","0","0","0","0","0","0","0","0"
"iteration_9","ColorNote Notepad Notes","PRODUCTIVITY","be82a3cf-e67e-47e5-93b3-59111dab38c1","0","Aug 28, 2022","3","f_193","Dear Sir We Want: 1/ Folder Note Options & 2/ Multiple Account Support like Google Keep","Dear Sir We Want: 1/ Folder Note Options & 2/ Multiple Account Support like Google Keep","0","0","0","0","0","0","0","1","0","0"
"iteration_9","Turtl","PRODUCTIVITY","56199656-fa28-4d39-9169-e7d594960f4a","2","Jan 07, 2019","4","f_482","I like Google Keep a lot but always worry about the data privacy issue. Turlt seem to be the solution. The data encryption and sync feature are very impressive. Wish that Turlt can support finger unlock to further enhance the security.","The data encryption and sync feature are very impressive.","0","1","0","0","0","0","0","0","0","0"
"iteration_9","SLOWLY - Make Global Friends","LIFESTYLE","5755e8d3-43d3-4fbd-aaa1-a77a48650123","0","Aug 07, 2022","5","f_220","If you want a to meet new people by using a penpal system. Use this app right now. You can be able to talk anyone in the world. Also they have stamps that you might want to collect.","If you want a to meet new people by using a penpal system.","0","0","0","0","0","0","0","0","0","0"
"iteration_9","Immediate Contact Transfer","TOOLS","fd68e4d1-3d21-45f5-8f0c-bf477787fd8a","1","Oct 26, 2020","1","f_330","Paid 55rs for the subscription but it was not done and they debited money. No subscription activated yet and sent email to the app developer email address but no response.","No subscription activated yet and sent email to the app developer email address but no response.","0","0","0","0","1","0","0","0","0","0"
"iteration_9","Kik — Messaging & Chat App","COMMUNICATION","a593025a-b6a3-4dec-823d-e4d31d2fbef0","0","Sep 04, 2022","3","f_220","Somehow kik fixed the meet new people feature. It no longer shows zero chats. But it's still got the chat limit issue. And I can't earn kin","Somehow kik fixed the meet new people feature.","0","0","0","0","0","0","0","0","0","0"
"iteration_9","Ayoba","COMMUNICATION","fcb3c1b7-92e6-4c47-b1e6-ce2de6f95abe","4","Sep 15, 2022","4","f_85","This app is cool and easy to use... You dont need data to use the app... Its just free. Easy to communicate.. Easy to share videos and pictures and tge network is moderate.🤓","Easy to share videos and pictures and tge network is moderate.🤓","1","0","0","0","0","0","0","0","0","0"
"iteration_9","Samsung Notes","PRODUCTIVITY","ec15955c-b4e8-42fd-95ac-a993548f6b15","1","Aug 28, 2022","4","f_451","A good notes program that comes pre-installed. some annoying quirks (as all apps have) but decent formatting options, ability to organise in folders including locked notes and you can easily share notes content across to other installed apps on your device.","some annoying quirks (as all apps have) but decent formatting options, ability to organise in folders including locked notes and you can easily share notes content across to other installed apps on your device.","0","0","0","0","0","0","0","0","1","0"
"iteration_9","Snapchat","COMMUNICATION","b47c07f2-26ea-42de-b25a-257b309b642e","0","Sep 14, 2022","1","f_106","Making boys,Girls....Abe sale..","Making boys,Girls....Abe sale..","0","0","0","0","0","0","0","0","0","1"
"iteration_9","Samsung Notes","PRODUCTIVITY","e74ffeae-1a01-4b05-b90a-b307e7e0c841","1","Jul 25, 2022","5","f_259","Best note taking app. The only thing that it need is table support and note hyperlinks. The ability to link a note to other notes (not to webpages).","The only thing that it need is table support and note hyperlinks.","0","0","0","0","0","0","0","1","0","0"
"iteration_9","Strava: Run, Ride, Hike","HEALTH_AND_FITNESS","ad5a9b60-3c80-46a8-bace-2cf50baf0289","1","Jul 14, 2022","1","f_416","Extremely poor optimization even for latest devices. Have you even tested the video upload feature? It looks like all the processing is made on the client side. I wonder how Google accepted this. The whole device just hangs and it's not possible to do anything. Pixel 6 with the latest updates","Have you even tested the video upload feature?","0","0","0","1","0","0","0","0","0","0"
"iteration_9","SMS Backup+","TOOLS","9a24e5bd-2e15-479c-95f3-2ddd3ac2afb2","1","Apr 21, 2021","4","f_202","works good, don't believe it works with gmail anymore but if you have a third party email server, Still works flawless... Would like to have a resync feature to re-sync all the messages again.","Would like to have a resync feature to re-sync all the messages again.","0","0","0","0","0","0","0","1","0","0"
"iteration_9","Garmin Smartphone Link","TRAVEL_AND_LOCAL","aeba44cb-ffa8-421b-820d-3267dc896f21","0","Nov 06, 2021","1","f_240","Absolutely ridiculous routing. Weight limit ahead, detour onto a DIRT ROAD to get around it?!? I DON'T THINK SO!!!","Absolutely ridiculous routing.","0","0","0","0","0","0","1","0","0","0"
"iteration_9","True Phone Dialer & Contacts","COMMUNICATION","a29a2628-5620-4fa5-a0d8-bb77db8c79b9","0","Dec 08, 2021","1","f_215","Kuch din baad apne aap call recording band ho jati hai","Kuch din baad apne aap call recording band ho jati hai","0","0","0","0","0","0","0","0","0","1"
"iteration_9","Cozi Family Organizer","PRODUCTIVITY","3c5204a9-8a4b-4ed2-a15d-004a00c99369","0","Jul 28, 2022","5","f_101","It is very simple to use as a shared family calendar","It is very simple to use as a shared family calendar","0","0","0","0","0","0","0","0","0","0"
"iteration_9","Immediate Contact Transfer","TOOLS","323baba8-66af-4527-9e49-90f62ad1902a","0","May 05, 2022","5","f_183","Good app and easy to tranafer Contacts mobile to mobile app","Good app and easy to tranafer Contacts mobile to mobile app","1","0","0","0","0","0","0","0","0","0"
"iteration_9","Notepad, Notes, Easy Notebook","PRODUCTIVITY","d3e3e574-4a88-4afb-aa83-2e7693c8f388","0","Sep 04, 2022","5","f_246","So far so good, I may be able to stop carrying so many notebooks.","So far so good, I may be able to stop carrying so many notebooks.","1","0","0","0","0","0","0","0","0","0"
"iteration_9","Any.do - To do list & Calendar","PRODUCTIVITY","b6bf2afb-237f-4699-8849-37db0afce57f","1","Jul 25, 2022","4","f_497","Love it so far. Would definitely use the ability to see my subtasks on my to do list during focus mode otherwise great","Would definitely use the ability to see my subtasks on my to do list during focus mode otherwise great","1","0","0","0","0","0","0","1","0","0"
"iteration_9","Social Contact Photo Sync","SOCIAL","e5f20739-166a-4e28-84d4-a9a573722132","2","Jul 26, 2017","1","f_189","The persistent notification stuff unless is ridiculous. Just use ads like everyone else.  Also, the app now will randomly sync contacts. On its own. Even after you tell it not to.","Also, the app now will randomly sync contacts.","0","0","0","1","0","0","0","0","0","0"
"iteration_9","Clock","TOOLS","e5f0a83c-8832-4ced-80f3-0f2bc67a948a","2","Jul 15, 2022","5","f_64","Best clock app. No ad bloating. Timers and alarms are perfectly done.","Timers and alarms are perfectly done.","1","0","0","0","0","0","0","0","0","0"
"iteration_9","Samsung Notes","PRODUCTIVITY","6b382fcf-9b3a-47d4-b62e-45a322b294af","0","Aug 22, 2022","4","f_121","use Samsung notes alot to make quick notes, prepare for meetings, presentations, discussions","use Samsung notes alot to make quick notes, prepare for meetings, presentations, discussions","0","1","0","0","0","0","0","0","0","0"
"iteration_9","WhatsApp Messenger","COMMUNICATION","dca5c6f9-1872-48b0-98f6-77f99fbb5cdc","0","Sep 14, 2022","3","f_130","We use this app for reporting, can you add also easy search for a group chat . Like i search for the name who report last sunday for example. Its hard to searh the report.","We use this app for reporting, can you add also easy search for a group chat .","0","0","0","0","0","0","0","1","0","0"
"iteration_9","WhatsApp Messenger","COMMUNICATION","cd5f200c-aa2e-42b7-8c18-9e76e031742a","1","Sep 14, 2022","5","f_416","Kindly give the features. Status history, Live video upload, change in user interface. Then it will be useful and interesting...","Status history, Live video upload, change in user interface.","0","0","0","0","0","0","0","1","0","0"
"iteration_9","To Do Reminder with Alarm","PRODUCTIVITY","76424cfd-202f-4117-b865-d43c860641f8","4","Jul 08, 2022","4","f_497","Great! I installed like 15 apps and nothing allows you to snooze tasks and this app does it even in more intuitive way. I tried too many like AnyDo, etc. 1.) Please add quick snooze in list view. 2.) features like subtasks and auto move missing that are in 'My Daily Planner' 3.) Please add unique sounds for different reminders. 4.) Please add ascending ring tones. 5.) Cannot move tasks up and down 🙏 Thank you","2.) features like subtasks and auto move missing that are in 'My Daily Planner' 3.)","0","0","0","0","1","0","0","0","0","0"
"iteration_9","Noisli: Focus and Relax","PRODUCTIVITY","74fee84a-939e-4d04-a24e-517fa6e73e7e","1","Aug 08, 2019","4","f_83","I've used noisli for years, long before I got the app. it's the only white noise thing that has that wonderfully deep engine sound, it puts me right into relaxation. but I'm really disappointed that it automatically stops playback when other audio starts. I need my white noise to block out other sounds, and like to listen to music or podcasts with it. this function makes the app half as useful as the desktop version. really disappointing.","it's the only white noise thing that has that wonderfully deep engine sound, it puts me right into relaxation.","1","0","0","0","0","0","0","0","0","0"
"iteration_9","SMS Backup+","TOOLS","886c0854-6eca-453b-9756-536700895c29","2","Aug 11, 2019","1","f_431","Bring back this app. Make it work again. This was such a great app for automatic backup to email sms and call log. Google has disconnected the link to Gmail. Can't we get it to work with another email?????","This was such a great app for automatic backup to email sms and call log.","0","0","0","0","0","0","0","0","0","0"
"iteration_9","MixNote NotePad Notes","PRODUCTIVITY","ab3a4f97-68fe-4bf4-ba9c-398fc886b1fb","2","Oct 19, 2017","3","f_482","good app, but it doesn't show links copied.it shows them as text not as links. also we don't know where the lpcked files are...it should have its own encryption rather than using app lock.","also we don't know where the lpcked files are...it should have its own encryption rather than using app lock.","0","0","0","0","1","0","0","0","0","0"
"iteration_9","To Do Reminder with Alarm","PRODUCTIVITY","6376096a-a499-47cd-b4cc-18714ade4e80","0","Apr 16, 2022","2","f_237","The alarm has never rung on my phone neither has it pop up any notification. When I open it then it shows series of missed reminders which defeats the purpose. It's like picking up a stick after the snake has escaped.","The alarm has never rung on my phone neither has it pop up any notification.","0","0","0","0","1","0","0","0","0","0"
"iteration_9","WA.Status Saver - Downloader","SOCIAL","5181f207-f75e-4805-94e5-a9f99638acd6","0","Apr 13, 2022","5","f_482","Among the status saver apps this one is the 👌 👍 because it doesn't take long to load and also it gives u options on which whatsap u can save from, it has unique features like that of message encryption I rate it five star","Among the status saver apps this one is the 👌 👍 because it doesn't take long to load and also it gives u options on which whatsap u can save from, it has unique features like that of message encryption I rate it five star","1","0","0","0","0","0","0","0","0","0"
"iteration_9","ColorNote Notepad Notes","PRODUCTIVITY","a3d643d4-cb00-4cfe-aed4-de7e6153d8dc","0","Jun 28, 2022","5","f_246","Excellent Notebook","Excellent Notebook","1","0","0","0","0","0","0","0","0","0"
"iteration_9","Brain Focus Productivity Timer","PRODUCTIVITY","684f8ba6-cf7d-48d8-89a5-6c3ad2b5cf80","4","Oct 02, 2020","5","f_209","Hello - I am confused about your products. I have one installed on my tablet that does what I want - it has categories of tasks and you can start and stop them as you need to. But even though play store said it was installed, it didn't install on my phone (Samsung Galaxy S8) so I installed the one that was available and bought a second subscription. This one does pomodoro and it's not the same - it doesn't have the same flexibility and I can't see how to put tasks into categories. How can I install the productivity timer on my phone? Can I sync between devices? It would be nice to be able to sync between a tablet and a phone - or at least copy all the tasks and categories across.","How can I install the productivity timer on my phone?","0","0","0","0","0","0","0","1","0","0"
"iteration_9","ColorNote Notepad Notes","PRODUCTIVITY","ab1e6c17-d37d-4096-9813-50b29d38f319","0","Jul 02, 2022","5","f_102","I use this ColorNote app daily for simple things like grocery lists and for very important things too that I need to remember! Love the app thank you😍 ⭐⭐⭐⭐⭐","I use this ColorNote app daily for simple things like grocery lists and for very important things too that I need to remember!","0","1","0","0","0","0","0","0","0","0"
"iteration_9","Garmin Connect™","HEALTH_AND_FITNESS","d954f55f-8107-47e0-9cc2-8fb1d6948732","0","Sep 15, 2022","2","f_9","Sleep tracking is very inaccurate. I'll be up until at least 3am and the tracker/app will record that I was asleep from 11:30pm. Never had this problem with Fitbit.","Sleep tracking is very inaccurate.","0","0","0","0","1","0","0","0","0","0"
"iteration_9","Material Notes: Colorful notes","PRODUCTIVITY","868a129c-2584-47a6-a11c-e76e613694ad","0","Aug 22, 2018","3","f_23","This app lets you easily take notes and materials design is just awesome 😍...but there should be an option of sync notes with Google drive or some other cloud services.","This app lets you easily take notes and materials design is just awesome 😍...but there should be an option of sync notes with Google drive or some other cloud services.","1","0","0","0","0","0","0","1","0","0"
"iteration_9","Facebook Lite","SOCIAL","6f0e1a1d-c913-4af0-be6d-00716da41ec0","1","Sep 13, 2022","1","f_424","Not responding. I can't go back whenever I open comment section untill i clear the cache or restart my phone.","I can't go back whenever I open comment section untill i clear the cache or restart my phone.","0","0","0","0","1","0","0","0","0","0"
"iteration_9","Google Keep - Notes and Lists","PRODUCTIVITY","52599706-1821-4b84-aa10-51212b7f0ff5","0","Sep 17, 2022","5","f_40","Simple and reliable notetaking app for android users","Simple and reliable notetaking app for android users","0","1","0","0","0","0","0","0","0","0"
"iteration_9","Microsoft Translator","PRODUCTIVITY","b0072021-9b9d-4fa5-9f50-1df4d063308c","1","Sep 08, 2022","5","f_14","Great App! Comes in handy for those of us that speak multiple languages 'almost' fluently. A quick look-up and you can translate to any language from any language. Also does a good job with sentence and Grammer structure. Doesn't do the literal word-for-word mess that ends up making no sense.","Comes in handy for those of us that speak multiple languages 'almost' fluently.","1","0","0","0","0","0","0","0","0","0"
"iteration_9","Sticker maker","TOOLS","7855afdb-5e9f-4fff-a325-38ee3f537c5c","0","Jun 25, 2022","1","f_80","Animated stickers behind paywall.","Animated stickers behind paywall.","0","0","0","0","1","0","0","0","0","0"
